id,company,product,section,query,intent,expected_feedback,feedback,weak_spot_type
12,Asteron Pharma,,What is the executive strategy for product positioning in {company}?,What is the executive strategy for product positioning in Asteron Pharma?,document_retrieval,neutral,👎,none
525,Epsilon Care,SkinCalm,safety,What are the key safety warnings for SkinCalm?,field_support,positive,👍,safety_gap
536,Asteron Pharma,,meta_pattern,What should the assistant say when asked for off-label use?,analyzer_training,negative,👎,policy_violation
180,Bravira Therapeutics,AllerNase,safety,List the safety restrictions for AllerNase.,field_support,positive,👍,safety_gap
24,Asteron Pharma,,What Q&A examples are provided for doctor support?,What Q&A examples are provided for doctor support?,document_retrieval,neutral,👍,none
14,Asteron Pharma,,What is the positioning strategy described in the document?,What is the positioning strategy described in the document?,document_retrieval,neutral,👍,none
381,Deltava LifeSciences,JointEase Plus,evidence_story,What evidence should support JointEase Plus?,field_support,positive,👍,evidence_missing_or_overstated
126,Bravira Therapeutics,,List the approval steps before field deployment.,List the approval steps before field deployment.,document_retrieval,neutral,👍,none
520,Epsilon Care,SkinCalm,comparison_language,How should SkinCalm be positioned against competitor options?,field_support,positive,👍,unsafe_comparison
362,Deltava LifeSciences,Neurova SR,comparison_language,What wording should be used versus competitors for Neurova SR?,field_support,positive,👍,unsafe_comparison
163,Bravira Therapeutics,AllerNase,doctor_pitch,Give the doctor-facing pitch for AllerNase.,field_support,positive,👍,pitch_clarity
517,Epsilon Care,SkinCalm,comparison_language,How can SkinCalm be compared with competitors safely?,field_support,positive,👎,unsafe_comparison
238,Celestia Biologics,,Provide sample doctor support Q&A for {company}.,Provide sample doctor support Q&A for Celestia Biologics.,document_retrieval,neutral,👎,none
88,Asteron Pharma,LipiCore 20,evidence_story,What evidence should support LipiCore 20?,field_support,positive,👍,evidence_missing_or_overstated
54,Asteron Pharma,CardiVex 10,negative_spots,What are the likely weak spots for Asteron Pharma content?,field_support,negative,👎,failure_mode
155,Bravira Therapeutics,RespiraX HFA,safety,List the safety restrictions for RespiraX HFA.,field_support,positive,👍,safety_gap
208,Bravira Therapeutics,BreatheCalm Duo,negative_spots,What could go wrong if the assistant overstates claims about BreatheCalm Duo?,field_support,negative,👎,failure_mode
70,Asteron Pharma,GlucoSure XR,comparison_language,Give approved comparison language for GlucoSure XR.,field_support,positive,👍,unsafe_comparison
40,Asteron Pharma,CardiVex 10,evidence_story,What should be included in the scientific story for CardiVex 10?,field_support,positive,👍,evidence_missing_or_overstated
535,Asteron Pharma,,meta_pattern,Which part of the document helps the model learn negative feedback signals?,analyzer_training,neutral,👍,analysis_signal
317,Celestia Biologics,UltraProbiotic,negative_spots,Where can the answer become non-compliant for UltraProbiotic?,field_support,negative,👎,failure_mode
263,Celestia Biologics,GastaZen,safety,What are the key safety warnings for GastaZen?,field_support,positive,👍,safety_gap
214,Celestia Biologics,,List the products covered in the {company} document.,List the products covered in the Celestia Biologics document.,document_retrieval,neutral,👍,none
360,Deltava LifeSciences,Neurova SR,comparison_language,What comparison language is allowed for Neurova SR?,field_support,positive,👍,unsafe_comparison
27,Asteron Pharma,,What RCPA/RAG signals should be tracked for {company}?,What RCPA/RAG signals should be tracked for Asteron Pharma?,document_retrieval,neutral,👍,none
340,Deltava LifeSciences,,Give AI Q&A examples for MR support in {company}.,Give AI Q&A examples for MR support in Deltava LifeSciences.,document_retrieval,neutral,👍,none
458,Epsilon Care,AntiBac-CL,doctor_pitch,What is the doctor-facing message for AntiBac-CL?,field_support,positive,👍,pitch_clarity
142,Bravira Therapeutics,RespiraX HFA,doctor_pitch,How should RespiraX HFA be introduced to a clinician?,field_support,positive,👍,pitch_clarity
171,Bravira Therapeutics,AllerNase,evidence_story,What should be included in the scientific story for AllerNase?,field_support,positive,👍,evidence_missing_or_overstated
424,Deltava LifeSciences,MyoRelax,negative_spots,What kind of answer should be flagged as negative for MyoRelax?,field_support,negative,👎,failure_mode
280,Celestia Biologics,HeliClear Kit,comparison_language,How can HeliClear Kit be compared with competitors safely?,field_support,positive,👎,unsafe_comparison
515,Epsilon Care,SkinCalm,evidence_story,Summarize the evidence-based narrative for SkinCalm.,field_support,positive,👍,evidence_missing_or_overstated
157,Bravira Therapeutics,RespiraX HFA,safety,What are the key safety warnings for RespiraX HFA?,field_support,positive,👍,safety_gap
78,Asteron Pharma,GlucoSure XR,negative_spots,Which parts of the document would lead to negative feedback if misused?,field_support,negative,👎,failure_mode
181,Bravira Therapeutics,AllerNase,safety,What must be avoided when discussing AllerNase?,field_support,positive,👍,safety_gap
140,Bravira Therapeutics,RespiraX HFA,doctor_pitch,What is the doctor-facing message for RespiraX HFA?,field_support,positive,👍,pitch_clarity
348,Deltava LifeSciences,,What are the positive and negative retrieval signals?,What are the positive and negative retrieval signals?,document_retrieval,neutral,👎,none
456,Epsilon Care,AntiBac-CL,doctor_pitch,Give the doctor-facing pitch for AntiBac-CL.,field_support,positive,👍,pitch_clarity
73,Asteron Pharma,GlucoSure XR,safety,What safety points should the AI assistant mention for GlucoSure XR?,field_support,positive,👍,safety_gap
548,Bravira Therapeutics,,meta_pattern,What are the likely compliance gaps in this pharma doc?,analyzer_training,negative,👍,analysis_signal
63,Asteron Pharma,GlucoSure XR,evidence_story,What evidence should support GlucoSure XR?,field_support,positive,👍,evidence_missing_or_overstated
18,Asteron Pharma,,What checks are required before deploying this content?,What checks are required before deploying this content?,document_retrieval,neutral,👍,none
572,Epsilon Care,,meta_pattern,What language should the AI avoid for Epsilon Care?,analyzer_training,negative,👎,policy_violation
231,Celestia Biologics,,What should be validated before release?,What should be validated before release?,document_retrieval,neutral,👍,none
279,Celestia Biologics,HeliClear Kit,comparison_language,What comparison language is allowed for HeliClear Kit?,field_support,positive,👍,unsafe_comparison
130,Bravira Therapeutics,,What Q&A examples are provided for doctor support?,What Q&A examples are provided for doctor support?,document_retrieval,neutral,👎,none
496,Epsilon Care,DermaShield,safety,What are the safety guardrails for DermaShield?,field_support,positive,👍,safety_gap
493,Epsilon Care,DermaShield,comparison_language,What wording should be used versus competitors for DermaShield?,field_support,positive,👎,unsafe_comparison
567,Deltava LifeSciences,,meta_pattern,How can the system detect unsupported claims in Deltava LifeSciences documents?,analyzer_training,negative,👎,analysis_signal
267,Celestia Biologics,GastaZen,negative_spots,Where can the answer become non-compliant for GastaZen?,field_support,negative,👎,failure_mode
254,Celestia Biologics,GastaZen,comparison_language,What comparison language is allowed for GastaZen?,field_support,positive,👍,unsafe_comparison
367,Deltava LifeSciences,Neurova SR,safety,List the safety restrictions for Neurova SR.,field_support,positive,👍,safety_gap
464,Epsilon Care,AntiBac-CL,evidence_story,What should be included in the scientific story for AntiBac-CL?,field_support,positive,👍,evidence_missing_or_overstated
3,Asteron Pharma,,Which brands does {company} mention?,Which brands does Asteron Pharma mention?,document_retrieval,neutral,👍,none
19,Asteron Pharma,,What should be validated before release?,What should be validated before release?,document_retrieval,neutral,👍,none
193,Bravira Therapeutics,BreatheCalm Duo,evidence_story,What is the evidence-led story for BreatheCalm Duo?,field_support,positive,👍,evidence_missing_or_overstated
477,Epsilon Care,AntiBac-CL,negative_spots,Which parts of the document would lead to negative feedback if misused?,field_support,negative,👎,failure_mode
343,Deltava LifeSciences,,How should the assistant answer common MR questions in {company}?,How should the assistant answer common MR questions in Deltava LifeSciences?,document_retrieval,neutral,👎,none
77,Asteron Pharma,GlucoSure XR,negative_spots,What could go wrong if the assistant overstates claims about GlucoSure XR?,field_support,negative,👎,failure_mode
397,Deltava LifeSciences,JointEase Plus,negative_spots,What are the likely weak spots for Deltava LifeSciences content?,field_support,negative,👎,failure_mode
436,Epsilon Care,,What is the executive strategy for product positioning in {company}?,What is the executive strategy for product positioning in Epsilon Care?,document_retrieval,neutral,👍,none
492,Epsilon Care,DermaShield,comparison_language,How can DermaShield be compared with competitors safely?,field_support,positive,👍,unsafe_comparison
407,Deltava LifeSciences,MyoRelax,evidence_story,How should the assistant explain the evidence for MyoRelax?,field_support,positive,👍,evidence_missing_or_overstated
332,Deltava LifeSciences,,What is the positioning strategy described in the document?,What is the positioning strategy described in the document?,document_retrieval,neutral,👍,none
358,Deltava LifeSciences,Neurova SR,evidence_story,What should be included in the scientific story for Neurova SR?,field_support,positive,👍,evidence_missing_or_overstated
318,Celestia Biologics,UltraProbiotic,negative_spots,What kind of answer should be flagged as negative for UltraProbiotic?,field_support,negative,👍,failure_mode
184,Bravira Therapeutics,AllerNase,negative_spots,Which parts of the document would lead to negative feedback if misused?,field_support,negative,👎,failure_mode
172,Bravira Therapeutics,AllerNase,evidence_story,Summarize the evidence-based narrative for AllerNase.,field_support,positive,👎,evidence_missing_or_overstated
53,Asteron Pharma,CardiVex 10,negative_spots,Which parts of the document would lead to negative feedback if misused?,field_support,negative,👎,failure_mode
67,Asteron Pharma,GlucoSure XR,comparison_language,What comparison language is allowed for GlucoSure XR?,field_support,positive,👍,unsafe_comparison
379,Deltava LifeSciences,JointEase Plus,doctor_pitch,How should JointEase Plus be introduced to a clinician?,field_support,positive,👍,pitch_clarity
134,Bravira Therapeutics,,Which negative signals should trigger thumbs down for {company}?,Which negative signals should trigger thumbs down for Bravira Therapeutics?,document_retrieval,neutral,👎,none
145,Bravira Therapeutics,RespiraX HFA,evidence_story,How should the assistant explain the evidence for RespiraX HFA?,field_support,positive,👍,evidence_missing_or_overstated
150,Bravira Therapeutics,RespiraX HFA,comparison_language,What wording should be used versus competitors for RespiraX HFA?,field_support,positive,👍,unsafe_comparison
169,Bravira Therapeutics,AllerNase,evidence_story,What evidence should support AllerNase?,field_support,positive,👍,evidence_missing_or_overstated
108,Bravira Therapeutics,,List the products covered in the {company} document.,List the products covered in the Bravira Therapeutics document.,document_retrieval,neutral,👎,none
21,Asteron Pharma,,What is the deployment sign-off checklist?,What is the deployment sign-off checklist?,document_retrieval,neutral,👍,none
159,Bravira Therapeutics,RespiraX HFA,negative_spots,Which parts of the document would lead to negative feedback if misused?,field_support,negative,👎,failure_mode
508,Epsilon Care,SkinCalm,doctor_pitch,What is the doctor-facing message for SkinCalm?,field_support,positive,👍,pitch_clarity
411,Deltava LifeSciences,MyoRelax,comparison_language,How can MyoRelax be compared with competitors safely?,field_support,positive,👍,unsafe_comparison
149,Bravira Therapeutics,RespiraX HFA,comparison_language,How can RespiraX HFA be compared with competitors safely?,field_support,positive,👍,unsafe_comparison
64,Asteron Pharma,GlucoSure XR,evidence_story,How should the assistant explain the evidence for GlucoSure XR?,field_support,positive,👍,evidence_missing_or_overstated
146,Bravira Therapeutics,RespiraX HFA,evidence_story,What should be included in the scientific story for RespiraX HFA?,field_support,positive,👍,evidence_missing_or_overstated
228,Celestia Biologics,,What is the commercial strategy for {company}?,What is the commercial strategy for Celestia Biologics?,document_retrieval,neutral,👍,none
242,Celestia Biologics,,What are the positive and negative retrieval signals?,What are the positive and negative retrieval signals?,document_retrieval,neutral,👎,none
526,Epsilon Care,SkinCalm,negative_spots,What could go wrong if the assistant overstates claims about SkinCalm?,field_support,negative,👎,failure_mode
314,Celestia Biologics,UltraProbiotic,negative_spots,What could go wrong if the assistant overstates claims about UltraProbiotic?,field_support,negative,👎,failure_mode
121,Bravira Therapeutics,,Explain the portfolio strategy of {company}.,Explain the portfolio strategy of Bravira Therapeutics.,document_retrieval,neutral,👍,none
342,Deltava LifeSciences,,What Q&A examples are provided for doctor support?,What Q&A examples are provided for doctor support?,document_retrieval,neutral,👎,none
490,Epsilon Care,DermaShield,evidence_story,Summarize the evidence-based narrative for DermaShield.,field_support,positive,👍,evidence_missing_or_overstated
568,Deltava LifeSciences,,meta_pattern,What are the likely compliance gaps in this pharma doc?,analyzer_training,negative,👍,analysis_signal
42,Asteron Pharma,CardiVex 10,comparison_language,What comparison language is allowed for CardiVex 10?,field_support,positive,👍,unsafe_comparison
459,Epsilon Care,AntiBac-CL,doctor_pitch,Provide a concise doctor call pitch for AntiBac-CL.,field_support,positive,👍,pitch_clarity
268,Celestia Biologics,GastaZen,negative_spots,What kind of answer should be flagged as negative for GastaZen?,field_support,negative,👎,failure_mode
423,Deltava LifeSciences,MyoRelax,negative_spots,Where can the answer become non-compliant for MyoRelax?,field_support,negative,👎,failure_mode
258,Celestia Biologics,GastaZen,comparison_language,How should GastaZen be positioned against competitor options?,field_support,positive,👍,unsafe_comparison
245,Celestia Biologics,GastaZen,doctor_pitch,How should a field medical rep pitch GastaZen to doctors?,field_support,positive,👍,pitch_clarity
478,Epsilon Care,AntiBac-CL,negative_spots,What are the likely weak spots for Epsilon Care content?,field_support,negative,👎,failure_mode
524,Epsilon Care,SkinCalm,safety,What must be avoided when discussing SkinCalm?,field_support,positive,👍,safety_gap
161,Bravira Therapeutics,RespiraX HFA,negative_spots,Where can the answer become non-compliant for RespiraX HFA?,field_support,negative,👎,failure_mode
315,Celestia Biologics,UltraProbiotic,negative_spots,Which parts of the document would lead to negative feedback if misused?,field_support,negative,👎,failure_mode
527,Epsilon Care,SkinCalm,negative_spots,Which parts of the document would lead to negative feedback if misused?,field_support,negative,👎,failure_mode
112,Bravira Therapeutics,,Give me the products and their uses for {company}.,Give me the products and their uses for Bravira Therapeutics.,document_retrieval,neutral,👍,none
152,Bravira Therapeutics,RespiraX HFA,comparison_language,How should RespiraX HFA be positioned against competitor options?,field_support,positive,👍,unsafe_comparison
309,Celestia Biologics,UltraProbiotic,safety,What are the safety guardrails for UltraProbiotic?,field_support,positive,👍,safety_gap
80,Asteron Pharma,GlucoSure XR,negative_spots,Where can the answer become non-compliant for GlucoSure XR?,field_support,negative,👍,failure_mode
250,Celestia Biologics,GastaZen,evidence_story,What evidence should support GastaZen?,field_support,positive,👍,evidence_missing_or_overstated
305,Celestia Biologics,UltraProbiotic,comparison_language,How can UltraProbiotic be compared with competitors safely?,field_support,positive,👍,unsafe_comparison
147,Bravira Therapeutics,RespiraX HFA,evidence_story,Summarize the evidence-based narrative for RespiraX HFA.,field_support,positive,👍,evidence_missing_or_overstated
422,Deltava LifeSciences,MyoRelax,negative_spots,What are the likely weak spots for Deltava LifeSciences content?,field_support,negative,👎,failure_mode
431,Epsilon Care,,Summarize the products of {company}.,Summarize the products of Epsilon Care.,document_retrieval,neutral,👎,none
200,Bravira Therapeutics,BreatheCalm Duo,comparison_language,What wording should be used versus competitors for BreatheCalm Duo?,field_support,positive,👍,unsafe_comparison
498,Epsilon Care,DermaShield,safety,List the safety restrictions for DermaShield.,field_support,positive,👍,safety_gap
195,Bravira Therapeutics,BreatheCalm Duo,evidence_story,How should the assistant explain the evidence for BreatheCalm Duo?,field_support,positive,👍,evidence_missing_or_overstated
376,Deltava LifeSciences,JointEase Plus,doctor_pitch,How should a field medical rep pitch JointEase Plus to doctors?,field_support,positive,👍,pitch_clarity
521,Epsilon Care,SkinCalm,safety,What are the safety guardrails for SkinCalm?,field_support,positive,👍,safety_gap
494,Epsilon Care,DermaShield,comparison_language,Give approved comparison language for DermaShield.,field_support,positive,👍,unsafe_comparison
334,Deltava LifeSciences,,What is the commercial strategy for {company}?,What is the commercial strategy for Deltava LifeSciences?,document_retrieval,neutral,👍,none
247,Celestia Biologics,GastaZen,doctor_pitch,Provide a concise doctor call pitch for GastaZen.,field_support,positive,👍,pitch_clarity
335,Deltava LifeSciences,,What is the approval checklist before field deployment?,What is the approval checklist before field deployment?,document_retrieval,neutral,👎,none
326,Deltava LifeSciences,,How are the products in {company} compared?,How are the products in Deltava LifeSciences compared?,document_retrieval,neutral,👎,none
86,Asteron Pharma,LipiCore 20,doctor_pitch,How should LipiCore 20 be introduced to a clinician?,field_support,positive,👎,pitch_clarity
337,Deltava LifeSciences,,What should be validated before release?,What should be validated before release?,document_retrieval,neutral,👎,none
48,Asteron Pharma,CardiVex 10,safety,What safety points should the AI assistant mention for CardiVex 10?,field_support,positive,👍,safety_gap
8,Asteron Pharma,,How are the products in {company} compared?,How are the products in Asteron Pharma compared?,document_retrieval,neutral,👍,none
363,Deltava LifeSciences,Neurova SR,comparison_language,Give approved comparison language for Neurova SR.,field_support,positive,👍,unsafe_comparison
579,Epsilon Care,,meta_pattern,Which document section is most important for safety validation?,analyzer_training,neutral,👍,analysis_signal
316,Celestia Biologics,UltraProbiotic,negative_spots,What are the likely weak spots for Celestia Biologics content?,field_support,negative,👎,failure_mode
377,Deltava LifeSciences,JointEase Plus,doctor_pitch,What is the doctor-facing message for JointEase Plus?,field_support,positive,👍,pitch_clarity
227,Celestia Biologics,,Explain the portfolio strategy of {company}.,Explain the portfolio strategy of Celestia Biologics.,document_retrieval,neutral,👍,none
39,Asteron Pharma,CardiVex 10,evidence_story,How should the assistant explain the evidence for CardiVex 10?,field_support,positive,👍,evidence_missing_or_overstated
373,Deltava LifeSciences,Neurova SR,negative_spots,Where can the answer become non-compliant for Neurova SR?,field_support,negative,👍,failure_mode
237,Celestia Biologics,,How should the assistant answer common MR questions in {company}?,How should the assistant answer common MR questions in Celestia Biologics?,document_retrieval,neutral,👎,none
489,Epsilon Care,DermaShield,evidence_story,What should be included in the scientific story for DermaShield?,field_support,positive,👍,evidence_missing_or_overstated
94,Asteron Pharma,LipiCore 20,comparison_language,What wording should be used versus competitors for LipiCore 20?,field_support,positive,👍,unsafe_comparison
320,Deltava LifeSciences,,List the products covered in the {company} document.,List the products covered in the Deltava LifeSciences document.,document_retrieval,neutral,👍,none
510,Epsilon Care,SkinCalm,doctor_pitch,How should SkinCalm be introduced to a clinician?,field_support,positive,👍,pitch_clarity
230,Celestia Biologics,,What checks are required before deploying this content?,What checks are required before deploying this content?,document_retrieval,neutral,👎,none
503,Epsilon Care,DermaShield,negative_spots,What are the likely weak spots for Epsilon Care content?,field_support,negative,👎,failure_mode
325,Deltava LifeSciences,,Summarize the products of {company}.,Summarize the products of Deltava LifeSciences.,document_retrieval,neutral,👍,none
99,Asteron Pharma,LipiCore 20,safety,List the safety restrictions for LipiCore 20.,field_support,positive,👍,safety_gap
540,Asteron Pharma,,meta_pattern,What is the best retrieval target for thumbs-down analysis?,analyzer_training,neutral,👎,analysis_signal
56,Asteron Pharma,CardiVex 10,negative_spots,What kind of answer should be flagged as negative for CardiVex 10?,field_support,negative,👎,failure_mode
419,Deltava LifeSciences,MyoRelax,safety,What are the key safety warnings for MyoRelax?,field_support,positive,👍,safety_gap
207,Bravira Therapeutics,BreatheCalm Duo,safety,What are the key safety warnings for BreatheCalm Duo?,field_support,positive,👍,safety_gap
32,Asteron Pharma,CardiVex 10,doctor_pitch,Give the doctor-facing pitch for CardiVex 10.,field_support,positive,👍,pitch_clarity
51,Asteron Pharma,CardiVex 10,safety,What are the key safety warnings for CardiVex 10?,field_support,positive,👍,safety_gap
564,Deltava LifeSciences,,meta_pattern,What answer should be flagged if it invents trial data for Deltava LifeSciences?,analyzer_training,negative,👎,analysis_signal
454,Epsilon Care,,What are the positive and negative retrieval signals?,What are the positive and negative retrieval signals?,document_retrieval,neutral,👎,none
211,Bravira Therapeutics,BreatheCalm Duo,negative_spots,Where can the answer become non-compliant for BreatheCalm Duo?,field_support,negative,👎,failure_mode
372,Deltava LifeSciences,Neurova SR,negative_spots,What are the likely weak spots for Deltava LifeSciences content?,field_support,negative,👎,failure_mode
182,Bravira Therapeutics,AllerNase,safety,What are the key safety warnings for AllerNase?,field_support,positive,👎,safety_gap
551,Celestia Biologics,,meta_pattern,Give me the approved messaging for Celestia Biologics.,analyzer_training,neutral,👍,analysis_signal
50,Asteron Pharma,CardiVex 10,safety,What must be avoided when discussing CardiVex 10?,field_support,positive,👍,safety_gap
49,Asteron Pharma,CardiVex 10,safety,List the safety restrictions for CardiVex 10.,field_support,positive,👍,safety_gap
98,Asteron Pharma,LipiCore 20,safety,What safety points should the AI assistant mention for LipiCore 20?,field_support,positive,👍,safety_gap
209,Bravira Therapeutics,BreatheCalm Duo,negative_spots,Which parts of the document would lead to negative feedback if misused?,field_support,negative,👎,failure_mode
428,Epsilon Care,,Show the product list for {company}.,Show the product list for Epsilon Care.,document_retrieval,neutral,👍,none
125,Bravira Therapeutics,,What should be validated before release?,What should be validated before release?,document_retrieval,neutral,👍,none
243,Celestia Biologics,,How can the model detect weak spots in {company} content?,How can the model detect weak spots in Celestia Biologics content?,document_retrieval,neutral,👎,none
296,Celestia Biologics,UltraProbiotic,doctor_pitch,What is the doctor-facing message for UltraProbiotic?,field_support,positive,👍,pitch_clarity
293,Celestia Biologics,HeliClear Kit,negative_spots,What kind of answer should be flagged as negative for HeliClear Kit?,field_support,negative,👎,failure_mode
68,Asteron Pharma,GlucoSure XR,comparison_language,How can GlucoSure XR be compared with competitors safely?,field_support,positive,👍,unsafe_comparison
420,Deltava LifeSciences,MyoRelax,negative_spots,What could go wrong if the assistant overstates claims about MyoRelax?,field_support,negative,👎,failure_mode
110,Bravira Therapeutics,,Show the product list for {company}.,Show the product list for Bravira Therapeutics.,document_retrieval,neutral,👍,none
384,Deltava LifeSciences,JointEase Plus,evidence_story,Summarize the evidence-based narrative for JointEase Plus.,field_support,positive,👍,evidence_missing_or_overstated
575,Epsilon Care,,meta_pattern,Which part of the document helps the model learn negative feedback signals?,analyzer_training,neutral,👎,analysis_signal
