id,company,product,section,query,intent,expected_feedback,feedback,weak_spot_type
122,Bravira Therapeutics,,What is the commercial strategy for {company}?,What is the commercial strategy for Bravira Therapeutics?,document_retrieval,neutral,👎,none
264,Celestia Biologics,GastaZen,negative_spots,What could go wrong if the assistant overstates claims about GastaZen?,field_support,negative,👎,failure_mode
346,Deltava LifeSciences,,Which negative signals should trigger thumbs down for {company}?,Which negative signals should trigger thumbs down for Deltava LifeSciences?,document_retrieval,neutral,👍,none
170,Bravira Therapeutics,AllerNase,evidence_story,How should the assistant explain the evidence for AllerNase?,field_support,positive,👎,evidence_missing_or_overstated
497,Epsilon Care,DermaShield,safety,What safety points should the AI assistant mention for DermaShield?,field_support,positive,👍,safety_gap
35,Asteron Pharma,CardiVex 10,doctor_pitch,Provide a concise doctor call pitch for CardiVex 10.,field_support,positive,👍,pitch_clarity
555,Celestia Biologics,,meta_pattern,Which part of the document helps the model learn negative feedback signals?,analyzer_training,neutral,👍,analysis_signal
569,Deltava LifeSciences,,meta_pattern,Which document section is most important for safety validation?,analyzer_training,neutral,👎,analysis_signal
324,Deltava LifeSciences,,Give me the products and their uses for {company}.,Give me the products and their uses for Deltava LifeSciences.,document_retrieval,neutral,👍,none
37,Asteron Pharma,CardiVex 10,evidence_story,What is the evidence-led story for CardiVex 10?,field_support,positive,👍,evidence_missing_or_overstated
4,Asteron Pharma,,Show the product list for {company}.,Show the product list for Asteron Pharma.,document_retrieval,neutral,👍,none
461,Epsilon Care,AntiBac-CL,evidence_story,What is the evidence-led story for AntiBac-CL?,field_support,positive,👍,evidence_missing_or_overstated
352,Deltava LifeSciences,Neurova SR,doctor_pitch,What is the doctor-facing message for Neurova SR?,field_support,positive,👍,pitch_clarity
499,Epsilon Care,DermaShield,safety,What must be avoided when discussing DermaShield?,field_support,positive,👍,safety_gap
438,Epsilon Care,,What is the positioning strategy described in the document?,What is the positioning strategy described in the document?,document_retrieval,neutral,👎,none
302,Celestia Biologics,UltraProbiotic,evidence_story,What should be included in the scientific story for UltraProbiotic?,field_support,positive,👍,evidence_missing_or_overstated
11,Asteron Pharma,,What is the summary of {company}'s portfolio?,What is the summary of Asteron Pharma's portfolio?,document_retrieval,neutral,👍,none
174,Bravira Therapeutics,AllerNase,comparison_language,How can AllerNase be compared with competitors safely?,field_support,positive,👍,unsafe_comparison
445,Epsilon Care,,What is the deployment sign-off checklist?,What is the deployment sign-off checklist?,document_retrieval,neutral,👎,none
116,Bravira Therapeutics,,How does {company} position its products against competitors?,How does Bravira Therapeutics position its products against competitors?,document_retrieval,neutral,👎,none
473,Epsilon Care,AntiBac-CL,safety,List the safety restrictions for AntiBac-CL.,field_support,positive,👍,safety_gap
62,Asteron Pharma,GlucoSure XR,evidence_story,What is the evidence-led story for GlucoSure XR?,field_support,positive,👍,evidence_missing_or_overstated
232,Celestia Biologics,,List the approval steps before field deployment.,List the approval steps before field deployment.,document_retrieval,neutral,👍,none
265,Celestia Biologics,GastaZen,negative_spots,Which parts of the document would lead to negative feedback if misused?,field_support,negative,👎,failure_mode
225,Celestia Biologics,,How should {company} position its brands strategically?,How should Celestia Biologics position its brands strategically?,document_retrieval,neutral,👎,none
405,Deltava LifeSciences,MyoRelax,evidence_story,What is the evidence-led story for MyoRelax?,field_support,positive,👍,evidence_missing_or_overstated
333,Deltava LifeSciences,,Explain the portfolio strategy of {company}.,Explain the portfolio strategy of Deltava LifeSciences.,document_retrieval,neutral,👎,none
344,Deltava LifeSciences,,Provide sample doctor support Q&A for {company}.,Provide sample doctor support Q&A for Deltava LifeSciences.,document_retrieval,neutral,👎,none
463,Epsilon Care,AntiBac-CL,evidence_story,How should the assistant explain the evidence for AntiBac-CL?,field_support,positive,👍,evidence_missing_or_overstated
552,Celestia Biologics,,meta_pattern,What language should the AI avoid for Celestia Biologics?,analyzer_training,negative,👍,policy_violation
366,Deltava LifeSciences,Neurova SR,safety,What safety points should the AI assistant mention for Neurova SR?,field_support,positive,👍,safety_gap
103,Asteron Pharma,LipiCore 20,negative_spots,Which parts of the document would lead to negative feedback if misused?,field_support,negative,👎,failure_mode
354,Deltava LifeSciences,Neurova SR,doctor_pitch,How should Neurova SR be introduced to a clinician?,field_support,positive,👍,pitch_clarity
402,Deltava LifeSciences,MyoRelax,doctor_pitch,What is the doctor-facing message for MyoRelax?,field_support,positive,👍,pitch_clarity
484,Epsilon Care,DermaShield,doctor_pitch,Provide a concise doctor call pitch for DermaShield.,field_support,positive,👍,pitch_clarity
447,Epsilon Care,,Show sample questions and answers for {company}.,Show sample questions and answers for Epsilon Care.,document_retrieval,neutral,👍,none
311,Celestia Biologics,UltraProbiotic,safety,List the safety restrictions for UltraProbiotic.,field_support,positive,👍,safety_gap
440,Epsilon Care,,What is the commercial strategy for {company}?,What is the commercial strategy for Epsilon Care?,document_retrieval,neutral,👍,none
475,Epsilon Care,AntiBac-CL,safety,What are the key safety warnings for AntiBac-CL?,field_support,positive,👍,safety_gap
85,Asteron Pharma,LipiCore 20,doctor_pitch,Provide a concise doctor call pitch for LipiCore 20.,field_support,positive,👍,pitch_clarity
578,Epsilon Care,,meta_pattern,What are the likely compliance gaps in this pharma doc?,analyzer_training,negative,👎,analysis_signal
244,Celestia Biologics,GastaZen,doctor_pitch,Give the doctor-facing pitch for GastaZen.,field_support,positive,👍,pitch_clarity
338,Deltava LifeSciences,,List the approval steps before field deployment.,List the approval steps before field deployment.,document_retrieval,neutral,👎,none
66,Asteron Pharma,GlucoSure XR,evidence_story,Summarize the evidence-based narrative for GlucoSure XR.,field_support,positive,👎,evidence_missing_or_overstated
65,Asteron Pharma,GlucoSure XR,evidence_story,What should be included in the scientific story for GlucoSure XR?,field_support,positive,👍,evidence_missing_or_overstated
273,Celestia Biologics,HeliClear Kit,doctor_pitch,How should HeliClear Kit be introduced to a clinician?,field_support,positive,👍,pitch_clarity
36,Asteron Pharma,CardiVex 10,doctor_pitch,How should CardiVex 10 be introduced to a clinician?,field_support,positive,👍,pitch_clarity
249,Celestia Biologics,GastaZen,evidence_story,What is the evidence-led story for GastaZen?,field_support,positive,👍,evidence_missing_or_overstated
375,Deltava LifeSciences,JointEase Plus,doctor_pitch,Give the doctor-facing pitch for JointEase Plus.,field_support,positive,👍,pitch_clarity
44,Asteron Pharma,CardiVex 10,comparison_language,What wording should be used versus competitors for CardiVex 10?,field_support,positive,👎,unsafe_comparison
41,Asteron Pharma,CardiVex 10,evidence_story,Summarize the evidence-based narrative for CardiVex 10.,field_support,positive,👍,evidence_missing_or_overstated
488,Epsilon Care,DermaShield,evidence_story,How should the assistant explain the evidence for DermaShield?,field_support,positive,👍,evidence_missing_or_overstated
124,Bravira Therapeutics,,What checks are required before deploying this content?,What checks are required before deploying this content?,document_retrieval,neutral,👎,none
30,Asteron Pharma,,What are the positive and negative retrieval signals?,What are the positive and negative retrieval signals?,document_retrieval,neutral,👍,none
123,Bravira Therapeutics,,What is the approval checklist before field deployment?,What is the approval checklist before field deployment?,document_retrieval,neutral,👍,none
158,Bravira Therapeutics,RespiraX HFA,negative_spots,What could go wrong if the assistant overstates claims about RespiraX HFA?,field_support,negative,👎,failure_mode
462,Epsilon Care,AntiBac-CL,evidence_story,What evidence should support AntiBac-CL?,field_support,positive,👍,evidence_missing_or_overstated
426,Epsilon Care,,List the products covered in the {company} document.,List the products covered in the Epsilon Care document.,document_retrieval,neutral,👍,none
10,Asteron Pharma,,How does {company} position its products against competitors?,How does Asteron Pharma position its products against competitors?,document_retrieval,neutral,👎,none
516,Epsilon Care,SkinCalm,comparison_language,What comparison language is allowed for SkinCalm?,field_support,positive,👎,unsafe_comparison
166,Bravira Therapeutics,AllerNase,doctor_pitch,Provide a concise doctor call pitch for AllerNase.,field_support,positive,👎,pitch_clarity
307,Celestia Biologics,UltraProbiotic,comparison_language,Give approved comparison language for UltraProbiotic.,field_support,positive,👍,unsafe_comparison
1,Asteron Pharma,,What products are listed in {company}?,What products are listed in Asteron Pharma?,document_retrieval,neutral,👍,none
272,Celestia Biologics,HeliClear Kit,doctor_pitch,Provide a concise doctor call pitch for HeliClear Kit.,field_support,positive,👎,pitch_clarity
399,Deltava LifeSciences,JointEase Plus,negative_spots,What kind of answer should be flagged as negative for JointEase Plus?,field_support,negative,👎,failure_mode
512,Epsilon Care,SkinCalm,evidence_story,What evidence should support SkinCalm?,field_support,positive,👍,evidence_missing_or_overstated
83,Asteron Pharma,LipiCore 20,doctor_pitch,How should a field medical rep pitch LipiCore 20 to doctors?,field_support,positive,👍,pitch_clarity
416,Deltava LifeSciences,MyoRelax,safety,What safety points should the AI assistant mention for MyoRelax?,field_support,positive,👎,safety_gap
192,Bravira Therapeutics,BreatheCalm Duo,doctor_pitch,How should BreatheCalm Duo be introduced to a clinician?,field_support,positive,👍,pitch_clarity
452,Epsilon Care,,Which negative signals should trigger thumbs down for {company}?,Which negative signals should trigger thumbs down for Epsilon Care?,document_retrieval,neutral,👎,none
102,Asteron Pharma,LipiCore 20,negative_spots,What could go wrong if the assistant overstates claims about LipiCore 20?,field_support,negative,👎,failure_mode
312,Celestia Biologics,UltraProbiotic,safety,What must be avoided when discussing UltraProbiotic?,field_support,positive,👍,safety_gap
414,Deltava LifeSciences,MyoRelax,comparison_language,How should MyoRelax be positioned against competitor options?,field_support,positive,👍,unsafe_comparison
509,Epsilon Care,SkinCalm,doctor_pitch,Provide a concise doctor call pitch for SkinCalm.,field_support,positive,👎,pitch_clarity
153,Bravira Therapeutics,RespiraX HFA,safety,What are the safety guardrails for RespiraX HFA?,field_support,positive,👍,safety_gap
321,Deltava LifeSciences,,Which brands does {company} mention?,Which brands does Deltava LifeSciences mention?,document_retrieval,neutral,👎,none
55,Asteron Pharma,CardiVex 10,negative_spots,Where can the answer become non-compliant for CardiVex 10?,field_support,negative,👎,failure_mode
260,Celestia Biologics,GastaZen,safety,What safety points should the AI assistant mention for GastaZen?,field_support,positive,👍,safety_gap
92,Asteron Pharma,LipiCore 20,comparison_language,What comparison language is allowed for LipiCore 20?,field_support,positive,👎,unsafe_comparison
391,Deltava LifeSciences,JointEase Plus,safety,What safety points should the AI assistant mention for JointEase Plus?,field_support,positive,👍,safety_gap
257,Celestia Biologics,GastaZen,comparison_language,Give approved comparison language for GastaZen.,field_support,positive,👎,unsafe_comparison
479,Epsilon Care,AntiBac-CL,negative_spots,Where can the answer become non-compliant for AntiBac-CL?,field_support,negative,👎,failure_mode
369,Deltava LifeSciences,Neurova SR,safety,What are the key safety warnings for Neurova SR?,field_support,positive,👍,safety_gap
435,Epsilon Care,,What is the summary of {company}'s portfolio?,What is the summary of Epsilon Care's portfolio?,document_retrieval,neutral,👎,none
2,Asteron Pharma,,List the products covered in the {company} document.,List the products covered in the Asteron Pharma document.,document_retrieval,neutral,👎,none
233,Celestia Biologics,,What is the deployment sign-off checklist?,What is the deployment sign-off checklist?,document_retrieval,neutral,👍,none
538,Asteron Pharma,,meta_pattern,What are the likely compliance gaps in this pharma doc?,analyzer_training,negative,👎,analysis_signal
223,Celestia Biologics,,What is the summary of {company}'s portfolio?,What is the summary of Celestia Biologics's portfolio?,document_retrieval,neutral,👍,none
151,Bravira Therapeutics,RespiraX HFA,comparison_language,Give approved comparison language for RespiraX HFA.,field_support,positive,👍,unsafe_comparison
58,Asteron Pharma,GlucoSure XR,doctor_pitch,How should a field medical rep pitch GlucoSure XR to doctors?,field_support,positive,👍,pitch_clarity
175,Bravira Therapeutics,AllerNase,comparison_language,What wording should be used versus competitors for AllerNase?,field_support,positive,👍,unsafe_comparison
329,Deltava LifeSciences,,What is the summary of {company}'s portfolio?,What is the summary of Deltava LifeSciences's portfolio?,document_retrieval,neutral,👍,none
502,Epsilon Care,DermaShield,negative_spots,Which parts of the document would lead to negative feedback if misused?,field_support,negative,👎,failure_mode
137,Bravira Therapeutics,,How can the model detect weak spots in {company} content?,How can the model detect weak spots in Bravira Therapeutics content?,document_retrieval,neutral,👍,none
385,Deltava LifeSciences,JointEase Plus,comparison_language,What comparison language is allowed for JointEase Plus?,field_support,positive,👎,unsafe_comparison
275,Celestia Biologics,HeliClear Kit,evidence_story,What evidence should support HeliClear Kit?,field_support,positive,👍,evidence_missing_or_overstated
350,Deltava LifeSciences,Neurova SR,doctor_pitch,Give the doctor-facing pitch for Neurova SR.,field_support,positive,👎,pitch_clarity
59,Asteron Pharma,GlucoSure XR,doctor_pitch,What is the doctor-facing message for GlucoSure XR?,field_support,positive,👍,pitch_clarity
370,Deltava LifeSciences,Neurova SR,negative_spots,What could go wrong if the assistant overstates claims about Neurova SR?,field_support,negative,👎,failure_mode
448,Epsilon Care,,What Q&A examples are provided for doctor support?,What Q&A examples are provided for doctor support?,document_retrieval,neutral,👎,none
6,Asteron Pharma,,Give me the products and their uses for {company}.,Give me the products and their uses for Asteron Pharma.,document_retrieval,neutral,👍,none
284,Celestia Biologics,HeliClear Kit,safety,What are the safety guardrails for HeliClear Kit?,field_support,positive,👍,safety_gap
129,Bravira Therapeutics,,Show sample questions and answers for {company}.,Show sample questions and answers for Bravira Therapeutics.,document_retrieval,neutral,👍,none
543,Bravira Therapeutics,,meta_pattern,How should a rep respond if a doctor asks for comparison with competitors?,analyzer_training,neutral,👍,analysis_signal
240,Celestia Biologics,,Which negative signals should trigger thumbs down for {company}?,Which negative signals should trigger thumbs down for Celestia Biologics?,document_retrieval,neutral,👍,none
446,Epsilon Care,,Give AI Q&A examples for MR support in {company}.,Give AI Q&A examples for MR support in Epsilon Care.,document_retrieval,neutral,👎,none
196,Bravira Therapeutics,BreatheCalm Duo,evidence_story,What should be included in the scientific story for BreatheCalm Duo?,field_support,positive,👍,evidence_missing_or_overstated
198,Bravira Therapeutics,BreatheCalm Duo,comparison_language,What comparison language is allowed for BreatheCalm Duo?,field_support,positive,👍,unsafe_comparison
570,Deltava LifeSciences,,meta_pattern,What is the best retrieval target for thumbs-down analysis?,analyzer_training,neutral,👍,analysis_signal
306,Celestia Biologics,UltraProbiotic,comparison_language,What wording should be used versus competitors for UltraProbiotic?,field_support,positive,👍,unsafe_comparison
217,Celestia Biologics,,What are the key products under {company}?,What are the key products under Celestia Biologics?,document_retrieval,neutral,👍,none
554,Celestia Biologics,,meta_pattern,What answer should be flagged if it invents trial data for Celestia Biologics?,analyzer_training,negative,👎,analysis_signal
406,Deltava LifeSciences,MyoRelax,evidence_story,What evidence should support MyoRelax?,field_support,positive,👍,evidence_missing_or_overstated
530,Epsilon Care,SkinCalm,negative_spots,What kind of answer should be flagged as negative for SkinCalm?,field_support,negative,👎,failure_mode
322,Deltava LifeSciences,,Show the product list for {company}.,Show the product list for Deltava LifeSciences.,document_retrieval,neutral,👍,none
79,Asteron Pharma,GlucoSure XR,negative_spots,What are the likely weak spots for Asteron Pharma content?,field_support,negative,👎,failure_mode
57,Asteron Pharma,GlucoSure XR,doctor_pitch,Give the doctor-facing pitch for GlucoSure XR.,field_support,positive,👍,pitch_clarity
441,Epsilon Care,,What is the approval checklist before field deployment?,What is the approval checklist before field deployment?,document_retrieval,neutral,👍,none
25,Asteron Pharma,,How should the assistant answer common MR questions in {company}?,How should the assistant answer common MR questions in Asteron Pharma?,document_retrieval,neutral,👎,none
387,Deltava LifeSciences,JointEase Plus,comparison_language,What wording should be used versus competitors for JointEase Plus?,field_support,positive,👍,unsafe_comparison
533,Asteron Pharma,,meta_pattern,How should a rep respond if a doctor asks for comparison with competitors?,analyzer_training,neutral,👍,analysis_signal
253,Celestia Biologics,GastaZen,evidence_story,Summarize the evidence-based narrative for GastaZen.,field_support,positive,👍,evidence_missing_or_overstated
261,Celestia Biologics,GastaZen,safety,List the safety restrictions for GastaZen.,field_support,positive,👍,safety_gap
71,Asteron Pharma,GlucoSure XR,comparison_language,How should GlucoSure XR be positioned against competitor options?,field_support,positive,👍,unsafe_comparison
506,Epsilon Care,SkinCalm,doctor_pitch,Give the doctor-facing pitch for SkinCalm.,field_support,positive,👍,pitch_clarity
186,Bravira Therapeutics,AllerNase,negative_spots,Where can the answer become non-compliant for AllerNase?,field_support,negative,👎,failure_mode
205,Bravira Therapeutics,BreatheCalm Duo,safety,List the safety restrictions for BreatheCalm Duo.,field_support,positive,👍,safety_gap
299,Celestia Biologics,UltraProbiotic,evidence_story,What is the evidence-led story for UltraProbiotic?,field_support,positive,👍,evidence_missing_or_overstated
562,Deltava LifeSciences,,meta_pattern,What language should the AI avoid for Deltava LifeSciences?,analyzer_training,negative,👎,policy_violation
220,Celestia Biologics,,How are the products in {company} compared?,How are the products in Celestia Biologics compared?,document_retrieval,neutral,👎,none
300,Celestia Biologics,UltraProbiotic,evidence_story,What evidence should support UltraProbiotic?,field_support,positive,👎,evidence_missing_or_overstated
383,Deltava LifeSciences,JointEase Plus,evidence_story,What should be included in the scientific story for JointEase Plus?,field_support,positive,👍,evidence_missing_or_overstated
135,Bravira Therapeutics,,How should feedback be captured for {company} documents?,How should feedback be captured for Bravira Therapeutics documents?,document_retrieval,neutral,👍,none
276,Celestia Biologics,HeliClear Kit,evidence_story,How should the assistant explain the evidence for HeliClear Kit?,field_support,positive,👍,evidence_missing_or_overstated
288,Celestia Biologics,HeliClear Kit,safety,What are the key safety warnings for HeliClear Kit?,field_support,positive,👍,safety_gap
382,Deltava LifeSciences,JointEase Plus,evidence_story,How should the assistant explain the evidence for JointEase Plus?,field_support,positive,👎,evidence_missing_or_overstated
127,Bravira Therapeutics,,What is the deployment sign-off checklist?,What is the deployment sign-off checklist?,document_retrieval,neutral,👎,none
534,Asteron Pharma,,meta_pattern,What answer should be flagged if it invents trial data for Asteron Pharma?,analyzer_training,negative,👎,analysis_signal
136,Bravira Therapeutics,,What are the positive and negative retrieval signals?,What are the positive and negative retrieval signals?,document_retrieval,neutral,👎,none
565,Deltava LifeSciences,,meta_pattern,Which part of the document helps the model learn negative feedback signals?,analyzer_training,neutral,👎,analysis_signal
235,Celestia Biologics,,Show sample questions and answers for {company}.,Show sample questions and answers for Celestia Biologics.,document_retrieval,neutral,👍,none
330,Deltava LifeSciences,,What is the executive strategy for product positioning in {company}?,What is the executive strategy for product positioning in Deltava LifeSciences?,document_retrieval,neutral,👍,none
469,Epsilon Care,AntiBac-CL,comparison_language,Give approved comparison language for AntiBac-CL.,field_support,positive,👎,unsafe_comparison
453,Epsilon Care,,How should feedback be captured for {company} documents?,How should feedback be captured for Epsilon Care documents?,document_retrieval,neutral,👎,none
203,Bravira Therapeutics,BreatheCalm Duo,safety,What are the safety guardrails for BreatheCalm Duo?,field_support,positive,👍,safety_gap
256,Celestia Biologics,GastaZen,comparison_language,What wording should be used versus competitors for GastaZen?,field_support,positive,👍,unsafe_comparison
336,Deltava LifeSciences,,What checks are required before deploying this content?,What checks are required before deploying this content?,document_retrieval,neutral,👍,none
491,Epsilon Care,DermaShield,comparison_language,What comparison language is allowed for DermaShield?,field_support,positive,👍,unsafe_comparison
495,Epsilon Care,DermaShield,comparison_language,How should DermaShield be positioned against competitor options?,field_support,positive,👍,unsafe_comparison
545,Bravira Therapeutics,,meta_pattern,Which part of the document helps the model learn negative feedback signals?,analyzer_training,neutral,👍,analysis_signal
449,Epsilon Care,,How should the assistant answer common MR questions in {company}?,How should the assistant answer common MR questions in Epsilon Care?,document_retrieval,neutral,👎,none
291,Celestia Biologics,HeliClear Kit,negative_spots,What are the likely weak spots for Celestia Biologics content?,field_support,negative,👎,failure_mode
483,Epsilon Care,DermaShield,doctor_pitch,What is the doctor-facing message for DermaShield?,field_support,positive,👍,pitch_clarity
468,Epsilon Care,AntiBac-CL,comparison_language,What wording should be used versus competitors for AntiBac-CL?,field_support,positive,👎,unsafe_comparison
109,Bravira Therapeutics,,Which brands does {company} mention?,Which brands does Bravira Therapeutics mention?,document_retrieval,neutral,👎,none
34,Asteron Pharma,CardiVex 10,doctor_pitch,What is the doctor-facing message for CardiVex 10?,field_support,positive,👎,pitch_clarity
138,Bravira Therapeutics,RespiraX HFA,doctor_pitch,Give the doctor-facing pitch for RespiraX HFA.,field_support,positive,👎,pitch_clarity
206,Bravira Therapeutics,BreatheCalm Duo,safety,What must be avoided when discussing BreatheCalm Duo?,field_support,positive,👍,safety_gap
162,Bravira Therapeutics,RespiraX HFA,negative_spots,What kind of answer should be flagged as negative for RespiraX HFA?,field_support,negative,👎,failure_mode
413,Deltava LifeSciences,MyoRelax,comparison_language,Give approved comparison language for MyoRelax.,field_support,positive,👎,unsafe_comparison
17,Asteron Pharma,,What is the approval checklist before field deployment?,What is the approval checklist before field deployment?,document_retrieval,neutral,👎,none
421,Deltava LifeSciences,MyoRelax,negative_spots,Which parts of the document would lead to negative feedback if misused?,field_support,negative,👎,failure_mode
118,Bravira Therapeutics,,What is the executive strategy for product positioning in {company}?,What is the executive strategy for product positioning in Bravira Therapeutics?,document_retrieval,neutral,👎,none
29,Asteron Pharma,,How should feedback be captured for {company} documents?,How should feedback be captured for Asteron Pharma documents?,document_retrieval,neutral,👍,none
398,Deltava LifeSciences,JointEase Plus,negative_spots,Where can the answer become non-compliant for JointEase Plus?,field_support,negative,👎,failure_mode
394,Deltava LifeSciences,JointEase Plus,safety,What are the key safety warnings for JointEase Plus?,field_support,positive,👍,safety_gap
